{
  "schemaVersion": "0.1.0",
  "releaseId": "ohri-crozat-pkd2l1-functional-profile-0.1.0",
  "releaseDate": "2026-09-01",
  "title": "Source-local PKD2L1 CSF-contacting-neuron anatomy and electrophysiology profile",
  "source": {
    "publication": {
      "citation": "Crozat et al. 2025, Communications Biology",
      "doi": "10.1038/s42003-025-08559-x",
      "articleUrl": "https://doi.org/10.1038/s42003-025-08559-x",
      "dataAvailabilityBoundary": "The Figshare deposit contains source data underlying graphs and charts. Raw acquisition traces, ABF files, source microscopy images and a stable cross-experiment cell roster are not deposited in this release."
    },
    "figshare": {
      "articleId": 29430869,
      "version": 2,
      "doi": "10.6084/m9.figshare.29430869.v2",
      "landingPageUrl": "https://figshare.com/articles/dataset/29430869",
      "apiUrl": "https://api.figshare.com/v2/articles/29430869",
      "versionApiUrl": "https://api.figshare.com/v2/articles/29430869/versions/2",
      "definedType": "dataset",
      "public": true,
      "downloadDisabled": false,
      "linkedFileCount": 0,
      "fileCount": 92,
      "totalBytes": 1848613,
      "license": {
        "id": "CC-BY-4.0",
        "name": "CC BY 4.0",
        "url": "https://creativecommons.org/licenses/by/4.0/",
        "appliesTo": "Figshare dataset version 2 and its downloadable files"
      },
      "inventorySummary": [
        {
          "extension": "xlsx",
          "fileCount": 74,
          "bytes": 1242220
        },
        {
          "extension": "csv",
          "fileCount": 5,
          "bytes": 324196
        },
        {
          "extension": "Rmd",
          "fileCount": 7,
          "bytes": 243261
        },
        {
          "extension": ".DS_Store",
          "fileCount": 6,
          "bytes": 38936
        }
      ],
      "keyFiles": [
        {
          "id": 56062529,
          "folder": "1_ProPass",
          "fileName": "Firing_pattern.xlsx",
          "bytes": 10218,
          "publisherMd5": "a279d90783b573dfc6957306e740a25f",
          "locallyVerifiedSha256": "e39885a173b34b083fd58c00617c3ea4190a9e3376964cce90ff5f3c64f42910",
          "worksheetDimensions": [
            "Sheet1!A1:C7"
          ],
          "purpose": "segment-level tonic-versus-single-spike percentages"
        },
        {
          "id": 56062523,
          "folder": "1_ProPass",
          "fileName": "Firing_pattern-Details.xlsx",
          "bytes": 29101,
          "publisherMd5": "8c8a2211d143ce6d2b9d733428ceef5f",
          "locallyVerifiedSha256": "18d8e4c8f2075f82a9fc2d438e8cbf6b13107800e5d36847f0937b2a4e036427",
          "worksheetDimensions": [
            "Sheet1!A1:Q31"
          ],
          "purpose": "segment-level animal and cell denominators plus exact firing counts"
        },
        {
          "id": 56062526,
          "folder": "1_ProPass",
          "fileName": "Firing_pattern_Loc.xlsx",
          "bytes": 9287,
          "publisherMd5": "e4f9358ef3fdd6154121f9292910fd9c",
          "locallyVerifiedSha256": "87798adbd9241f148ca5d9f1a902088fa39fee8906e9ded4f42000174074a9da",
          "worksheetDimensions": [
            "Sheet1!A1:D13"
          ],
          "purpose": "incomplete cervical/thoracic quadrant-by-firing-pattern percentages without denominators; quarantined from localization inference"
        },
        {
          "id": 56062514,
          "folder": "1_ProPass",
          "fileName": "PropPass_Stats.xlsx",
          "bytes": 60261,
          "publisherMd5": "c63cb7267b91c63380453bd75b60749d",
          "locallyVerifiedSha256": "3f3d45f77527da42710e84394e8c4a9a4bedbdb016d94901d509348ca5b59465",
          "worksheetDimensions": [
            "Sheet1 meaningful cells A1:F655",
            "worksheet formatting extent reaches row 1048571"
          ],
          "purpose": "passive-property observation table; 654 complete deposited rows versus article n=659 conflict"
        },
        {
          "id": 56062520,
          "folder": "1_ProPass",
          "fileName": "RMP.xlsx",
          "bytes": 13220,
          "publisherMd5": "eab5f32ecfc030bcf0731ca25dd69a26",
          "locallyVerifiedSha256": "4fb402abbe55d92485e4f7bcb6dc3c68ee94d861bc031699cbc855fb153aea54",
          "worksheetDimensions": [
            "Sheet1 meaningful cells A1:C126",
            "formatted dimension A1:C254"
          ],
          "purpose": "resting-membrane-potential observations plus embedded analysis blocks"
        },
        {
          "id": 56064398,
          "folder": "6-Anatomie",
          "fileName": "Cell_distances.csv",
          "bytes": 32479,
          "publisherMd5": "07a695d21d5b8867680122167076ce5b",
          "locallyVerifiedSha256": "d94dbf2f04ad52f6362bc761303505afd0020d8eff9d4c0d1017c183208ca51b",
          "worksheetDimensions": [],
          "purpose": "source-local central-canal distance arrays without stable cell identifiers"
        },
        {
          "id": 56064401,
          "folder": "6-Anatomie",
          "fileName": "Data_Figures_1_2.xlsx",
          "bytes": 159782,
          "publisherMd5": "b96c64af0e6c2de540fe63f132551190",
          "locallyVerifiedSha256": "af8e6593d27ba7eeb6280b38b97876b65fb74560e6cb90680e2bc4d3b16f919a",
          "worksheetDimensions": [
            "Cell_densities_and_D_V_L_distri!A1:AC53",
            "Cell_distances!B1:G1015",
            "Data_Figures-1_2!B1:P1596"
          ],
          "purpose": "anatomy, density and central-canal-distance source tables"
        }
      ],
      "sourceFilesBundled": false,
      "derivedFactualMetadataBundled": true,
      "sourceFileBoundary": "The application bundles checksum-pinned factual derivatives and direct download links, not the 92 source files. Re-acquisition must verify the publisher MD5, byte count and project-recorded SHA-256 before parsing."
    }
  },
  "scope": {
    "species": "Mus musculus",
    "taxonId": "NCBITaxon:10090",
    "lifeStage": "3–6 weeks",
    "sexContext": "both sexes used; sex is not retained per observation",
    "spinalRegion": "cervical, thoracic and lumbar spinal cord",
    "preparation": "acute 250 µm spinal slices for electrophysiology; source-local anatomy tables for central-canal-contacting cells",
    "markerContext": "Pkd2l1-Cre::tdTomato / PKD2L1-positive CSF-contacting neurons",
    "displayedProfileCount": 1,
    "exactCrossSourceIdentityCount": 0,
    "projectRegistrationCount": 0,
    "admittedGeometryCount": 0
  },
  "sourceLocators": [
    {
      "id": "figshare-v2-api",
      "locator": "Figshare article 29430869 version 2 API and 92-file inventory",
      "evidenceStatus": "checksum_pinned_remote_inventory"
    },
    {
      "id": "firing-percent-sheet",
      "locator": "Firing_pattern.xlsx · file 56062529 · Sheet1!A1:C7",
      "evidenceStatus": "checksum_pinned_source_cells"
    },
    {
      "id": "firing-count-sheet",
      "locator": "Firing_pattern-Details.xlsx · file 56062523 · Sheet1!M25:Q31",
      "evidenceStatus": "checksum_pinned_source_cells_with_quarantined_p_value_conflict"
    },
    {
      "id": "firing-location-sheet",
      "locator": "Firing_pattern_Loc.xlsx · file 56062526 · Sheet1!A1:D13; cervical/thoracic only and no denominators",
      "evidenceStatus": "quarantined_incomplete_exploratory_table"
    },
    {
      "id": "passive-properties-sheet",
      "locator": "PropPass_Stats.xlsx · file 56062514 · meaningful cells Sheet1!A1:F655; 654 complete rows",
      "evidenceStatus": "checksum_pinned_observation_table_with_denominator_conflict"
    },
    {
      "id": "rmp-sheet",
      "locator": "RMP.xlsx · file 56062520 · meaningful cells Sheet1!A1:C126; 125 Cell/Level/RMP observations",
      "evidenceStatus": "checksum_pinned_observation_table"
    },
    {
      "id": "anatomy-workbook",
      "locator": "Data_Figures_1_2.xlsx · file 56064401 · three source worksheets",
      "evidenceStatus": "checksum_pinned_source_tables"
    },
    {
      "id": "cell-distance-csv",
      "locator": "Cell_distances.csv · file 56064398",
      "evidenceStatus": "checksum_pinned_source_table"
    },
    {
      "id": "primary-article-methods",
      "locator": "Crozat et al. 2025 · Methods and source-data availability",
      "evidenceStatus": "primary_article"
    },
    {
      "id": "primary-article-results",
      "locator": "Crozat et al. 2025 · segment-specific physiology, anatomy and pH-sensing results",
      "evidenceStatus": "primary_article"
    }
  ],
  "derivedEvidence": {
    "firingPatterns": [
      {
        "segment": "cervical",
        "animalCount": 10,
        "cellCount": 21,
        "tonicCount": 14,
        "tonicPercent": 67,
        "singleSpikeCount": 7,
        "singleSpikePercent": 33,
        "sourceLocatorIds": [
          "firing-percent-sheet",
          "firing-count-sheet"
        ]
      },
      {
        "segment": "thoracic",
        "animalCount": 12,
        "cellCount": 23,
        "tonicCount": 9,
        "tonicPercent": 39,
        "singleSpikeCount": 14,
        "singleSpikePercent": 61,
        "sourceLocatorIds": [
          "firing-percent-sheet",
          "firing-count-sheet"
        ]
      },
      {
        "segment": "lumbar",
        "animalCount": 9,
        "cellCount": 21,
        "tonicCount": 15,
        "tonicPercent": 71,
        "singleSpikeCount": 6,
        "singleSpikePercent": 29,
        "sourceLocatorIds": [
          "firing-percent-sheet",
          "firing-count-sheet"
        ]
      }
    ],
    "firingPatternFrame": {
      "totalCellCount": 65,
      "tonicCount": 38,
      "singleSpikeCount": 27,
      "primaryArticleFisherExactP": 0.000003772,
      "embeddedWorkbookFisherP": 0.0616,
      "reconciliationStatus": "conflict_quarantined",
      "quadrantAssociationStatus": "not_established",